[
  {
    "id": "chapter_1",
    "number": 1,
    "slug": "samadhi-pada",
    "theme": "samadhi",
    "sutraIds": [
      "sutra_1_01",
      "sutra_1_02",
      "sutra_1_03",
      "sutra_1_04",
      "sutra_1_05",
      "sutra_1_06",
      "sutra_1_07",
      "sutra_1_08",
      "sutra_1_09",
      "sutra_1_10",
      "sutra_1_11",
      "sutra_1_12",
      "sutra_1_13",
      "sutra_1_14",
      "sutra_1_15",
      "sutra_1_16",
      "sutra_1_17",
      "sutra_1_18",
      "sutra_1_19",
      "sutra_1_20",
      "sutra_1_21",
      "sutra_1_22",
      "sutra_1_23",
      "sutra_1_24",
      "sutra_1_25",
      "sutra_1_26",
      "sutra_1_27",
      "sutra_1_28",
      "sutra_1_29",
      "sutra_1_30",
      "sutra_1_31",
      "sutra_1_32",
      "sutra_1_33",
      "sutra_1_34",
      "sutra_1_35",
      "sutra_1_36",
      "sutra_1_37",
      "sutra_1_38",
      "sutra_1_39",
      "sutra_1_40",
      "sutra_1_41",
      "sutra_1_42",
      "sutra_1_43",
      "sutra_1_44",
      "sutra_1_45",
      "sutra_1_46",
      "sutra_1_47",
      "sutra_1_48",
      "sutra_1_49",
      "sutra_1_50",
      "sutra_1_51"
    ],
    "media": {
      "coverImage": null,
      "video": null
    }
  },
  {
    "id": "chapter_2",
    "number": 2,
    "slug": "sadhana-pada",
    "theme": "sadhana",
    "sutraIds": [
      "sutra_2_01",
      "sutra_2_02",
      "sutra_2_03",
      "sutra_2_04",
      "sutra_2_05",
      "sutra_2_06",
      "sutra_2_07",
      "sutra_2_08",
      "sutra_2_09",
      "sutra_2_10",
      "sutra_2_11",
      "sutra_2_12",
      "sutra_2_13",
      "sutra_2_14",
      "sutra_2_15",
      "sutra_2_16",
      "sutra_2_17",
      "sutra_2_18",
      "sutra_2_19",
      "sutra_2_20",
      "sutra_2_21",
      "sutra_2_22",
      "sutra_2_23",
      "sutra_2_24",
      "sutra_2_25",
      "sutra_2_26",
      "sutra_2_27",
      "sutra_2_28",
      "sutra_2_29",
      "sutra_2_30",
      "sutra_2_31",
      "sutra_2_32",
      "sutra_2_33",
      "sutra_2_34",
      "sutra_2_35",
      "sutra_2_36",
      "sutra_2_37",
      "sutra_2_38",
      "sutra_2_39",
      "sutra_2_40",
      "sutra_2_41",
      "sutra_2_42",
      "sutra_2_43",
      "sutra_2_44",
      "sutra_2_45",
      "sutra_2_46",
      "sutra_2_47",
      "sutra_2_48",
      "sutra_2_49",
      "sutra_2_50",
      "sutra_2_51",
      "sutra_2_52",
      "sutra_2_53",
      "sutra_2_54",
      "sutra_2_55"
    ],
    "media": {
      "coverImage": null,
      "video": null
    }
  }
]
